{
  "script_id": "scr_20260503_182954",
  "cluster_id": "evt_001",
  "title": "반도체 질주에…4월 수출도 800억弗 넘었다",
  "tone": "calm_economic_explainer_ko",
  "description": "경제 뉴스 흐름을 바탕으로 ETF 관점에서 핵심만 차분하게 정리한 롱폼 초안입니다.",
  "target_duration_sec": 240,
  "source_article_ids": [
    "art_284adf27fa2e057b",
    "art_45a19d9ffed3e2cf"
  ],
  "ledger_id": "led_evt_001_20260503_182808",
  "sections": [
    {
      "section_id": "sec_01",
      "objective": "hook",
      "narration": "오늘 시장은 숫자 하나보다 그 숫자가 바뀌는 속도에 더 민감하게 반응하고 있습니다.",
      "claim_ids": []
    },
    {
      "section_id": "sec_02",
      "objective": "today_core",
      "narration": "핵심은 금리, 환율, 그리고 수출과 내수의 속도 차이를 함께 봐야 한다는 점입니다.",
      "claim_ids": []
    },
    {
      "section_id": "sec_03",
      "objective": "evidence",
      "narration": "오늘 모은 기사들을 보면 정책과 시장 반응이 한 방향으로만 움직이지 않는다는 점이 반복해서 확인됩니다.",
      "claim_ids": []
    },
    {
      "section_id": "sec_04",
      "objective": "etf_link",
      "narration": "ETF 관점에서는 개별 종목보다 금리 민감도와 달러, 수출 업종 비중을 같이 해석하는 쪽이 더 안전합니다.",
      "claim_ids": []
    },
    {
      "section_id": "sec_05",
      "objective": "close",
      "narration": "결론적으로 오늘은 상승이나 하락 자체보다 어떤 변수에 시장이 먼저 반응하는지를 보는 날에 가깝습니다.",
      "claim_ids": []
    }
  ]
}