{
  "script_id": "scr_20260503_191307",
  "cluster_id": "evt_001",
  "title": "[분석] 역대급 4월 수출 성적표, 반도체가 주도하는 우리 경제의 반등 신호",
  "tone": "calm_economic_explainer_ko",
  "description": "2026년 4월 수출이 역대 두 번째 기록인 859억 달러를 달성했습니다. 반도체가 이끈 이번 수출 증가의 배경과 투자자 관점에서의 함의를 분석합니다.",
  "target_duration_sec": 600,
  "source_article_ids": [
    "art_284adf27fa2e057b",
    "art_45a19d9ffed3e2cf"
  ],
  "ledger_id": "led_evt_001_20260503_190434",
  "sections": [
    {
      "section_id": "section_1",
      "objective": "hook",
      "narration": "여러분의 투자 계좌가 체감하는 경기보다 나라 전체의 돈벌이가 훨씬 더 뜨겁다는 사실을 알고 계십니까? 최근 발표된 우리나라의 수출 성적표는 시장의 예상을 뛰어넘는 숫자를 보여주고 있습니다. 왜 이런 격차가 발생하는지, 그리고 이 숫자가 우리에게 어떤 기회를 시사하는지 지금부터 분석해 보겠습니다.",
      "claim_ids": []
    },
    {
      "section_id": "section_2",
      "objective": "today_core",
      "narration": "지난 4월 우리나라 수출액이 859억 달러를 기록하며 역대 두 번째로 높은 수치를 달성했습니다. 보도에 따르면 이는 전년 동월과 비교했을 때 무려 48%나 급증한 규모입니다. 우리 경제의 핵심 엔진인 수출이 다시 한번 강력한 동력을 얻고 있는 모습입니다.",
      "claim_ids": [
        "evt_001_cl_01",
        "evt_001_cl_02",
        "evt_001_cl_03"
      ]
    },
    {
      "section_id": "section_3",
      "objective": "background",
      "narration": "수출 국가인 한국에서 이 숫자가 중요한 이유는 기업의 실적과 환율, 그리고 증시의 방향성을 결정짓는 가장 기초적인 데이터이기 때문입니다. 장기간의 침체를 벗어나 본격적인 회복 궤도에 올랐는지 판단하는 기준이 바로 이 수출 총액에 달려 있습니다. 왜 지금 시점에서 이런 폭발적인 성장이 나타났는지 그 내부를 들여다볼 필요가 있습니다.",
      "claim_ids": []
    },
    {
      "section_id": "section_4",
      "objective": "evidence",
      "narration": "이번 기록적인 수출 성장의 1등 공신은 단연 반도체 섹터였습니다. 반도체 수출액은 불과 1년 사이에 3배 가까이 증가하며 전체 수출 증가세를 강력하게 견인했습니다. 특히 AI 열풍으로 인한 고성능 메모리 수요가 이 기록적인 숫자를 만든 핵심 동력으로 풀이됩니다.",
      "claim_ids": [
        "evt_001_cl_04"
      ]
    },
    {
      "section_id": "section_5",
      "objective": "mechanism",
      "narration": "왜 반도체가 이렇게 갑자기 많이 팔리는 걸까요? 글로벌 빅테크 기업들이 AI 데이터 센터를 구축하면서 필수 부품인 AI 반도체 수요가 폭증했기 때문입니다. 공급이 수요를 따라가지 못하는 상황이 이어지면서 수출 단가와 물량이 동시에 상승하는 선순환 구조가 만들어졌습니다.",
      "claim_ids": []
    },
    {
      "section_id": "section_6",
      "objective": "etf_link",
      "narration": "이러한 흐름에 주목하는 투자자들은 국내외 반도체 기업을 모아놓은 ETF 상품을 통해 시장의 성장에 참여하기도 합니다. 수출 데이터에서 확인된 반도체의 견고한 성장세는 관련 업종 전체의 펀더멘털을 강화하는 요인이 됩니다. 다만 특정 섹터에 대한 집중도가 높다는 점은 정보 제공 차원에서 인지할 필요가 있습니다.",
      "claim_ids": []
    },
    {
      "section_id": "section_7",
      "objective": "implication",
      "narration": "수출이 잘된다는 것은 단순히 기업이 돈을 많이 버는 것에 그치지 않고 국가의 달러 수급을 원활하게 만듭니다. 이는 장기적으로 원화 가치의 안정과 국내 증시로의 외국인 자금 유입을 기대하게 만드는 긍정적인 신호입니다. 왜 지금 이 숫자가 단순한 기록 경신 이상의 의미를 갖는지 이해하는 것이 중요합니다.",
      "claim_ids": []
    },
    {
      "section_id": "section_8",
      "objective": "risk",
      "narration": "물론 장밋빛 전망만 있는 것은 아닙니다. 반도체에 대한 수출 의존도가 지나치게 높아지면 해당 산업의 사이클이 꺾일 때 경제 전체가 받는 충격도 커질 수 있습니다. 또한 글로벌 경기 둔화나 지정학적 리스크로 인한 공급망 변수는 항상 염두에 두어야 할 위험 요소입니다.",
      "claim_ids": []
    },
    {
      "section_id": "section_9",
      "objective": "what_to_watch",
      "narration": "앞으로 우리가 주목해야 할 포인트는 이 수출 증가세가 반도체 외의 다른 품목으로 확산되는지 여부입니다. 매월 발표되는 수출입 동향 데이터에서 품목별 다변화가 일어나는지 확인하는 습관이 필요합니다. 또한 환율 변동이 수출 기업들의 실제 수익성에 어떤 영향을 주는지도 체크포인트입니다.",
      "claim_ids": []
    },
    {
      "section_id": "section_10",
      "objective": "close",
      "narration": "4월의 수출 859억 달러라는 숫자는 우리 경제의 강력한 회복 탄력성을 증명하고 있습니다. 오늘 살펴본 데이터가 여러분의 투자 판단에 든든한 기초가 되기를 바랍니다. 다음 시간에는 이 성장이 기업의 2분기 실적에 어떻게 투영될지 더 자세히 분석해 드리겠습니다.",
      "claim_ids": []
    }
  ]
}