{
  "script_id": "scr_20260503_183315",
  "cluster_id": "evt_001",
  "title": "4월 수출 859억 달러 돌파, 반도체가 견인한 역대 2위",
  "tone": "calm_economic_explainer_ko",
  "description": "최근 발표된 4월 수출 지표를 통해 반도체 산업의 질주와 AI 수요가 경제 전반에 미치는 영향을 분석하고 관련 ETF 시장의 흐름을 점검합니다.",
  "target_duration_sec": 240,
  "source_article_ids": [
    "art_284adf27fa2e057b",
    "art_45a19d9ffed3e2cf"
  ],
  "ledger_id": "led_evt_001_20260503_183300",
  "sections": [
    {
      "section_id": "sec_001",
      "objective": "hook",
      "narration": "최근 한국 경제의 기초 체력을 보여주는 수출 지표가 시장의 예상을 뛰어넘는 수치를 기록하며 화제가 되고 있습니다. 특히 반도체를 중심으로 한 가파른 회복세가 우리 경제의 핵심 동력으로 다시 부각되는 모습입니다.",
      "claim_ids": [
        "evt_001_cl_01"
      ]
    },
    {
      "section_id": "sec_002",
      "objective": "today_core",
      "narration": "산업통상자원부의 발표에 따르면 지난 4월 수출액은 859억 달러를 기록하며 역대 두 번째로 높은 성적을 거두었습니다. 이는 전년 동월 대비 약 48% 증가한 수치로, 반도체 수출액이 1년 사이 3배 가까이 늘어난 영향이 컸습니다.",
      "claim_ids": [
        "evt_001_cl_01",
        "evt_001_cl_02"
      ]
    },
    {
      "section_id": "sec_003",
      "objective": "background",
      "narration": "지난해까지만 해도 반도체 업황의 부진으로 인해 수출 전선에 경고등이 켜졌던 상황을 고려하면 상당한 반전입니다. 시장에서는 이번 기록이 단순한 기저효과를 넘어 본격적인 반등 국면에 진입했음을 시사하는 지표로 해석하고 있습니다.",
      "claim_ids": [
        "evt_001_cl_02"
      ]
    },
    {
      "section_id": "sec_004",
      "objective": "evidence",
      "narration": "기사 흐름상 이번 수출 호조의 일등 공신은 단연 반도체로 확인됩니다. 4월 한 달간 반도체 수출이 폭발적으로 증가하며 전체 수출 비중을 크게 끌어올린 점이 통계적으로 증명되었습니다.",
      "claim_ids": [
        "evt_001_cl_01",
        "evt_001_cl_02"
      ]
    },
    {
      "section_id": "sec_005",
      "objective": "mechanism",
      "narration": "이러한 급성장의 배경에는 전 세계적인 인공지능, 즉 AI 서버 투자 확대가 자리 잡고 있습니다. 고대역폭 메모리인 HBM을 포함한 고부가가치 제품에 대한 수요가 지속되면서 수출 단가와 물량이 동시에 상승하는 구조가 형성되었습니다.",
      "claim_ids": [
        "evt_001_cl_02"
      ]
    },
    {
      "section_id": "sec_006",
      "objective": "etf_link",
      "narration": "수출 데이터의 호조는 국내 반도체 기업들을 담고 있는 주요 ETF들의 수익률에도 긍정적인 심리를 전달하고 있습니다. 특히 국내 대형 반도체 제조사에 집중 투자하는 테마형 ETF들이 시장의 주목을 받는 배경이 되기도 합니다.",
      "claim_ids": []
    },
    {
      "section_id": "sec_007",
      "objective": "etf_link",
      "narration": "또한 글로벌 AI 반도체 밸류체인과 연결된 ETF들도 이번 수출 지표와 궤를 같이하고 있습니다. 한국 반도체 수출의 실질적인 수요처가 어디인지 확인하는 과정에서 관련 펀드들에 대한 시장의 관심도 함께 나타나고 있습니다.",
      "claim_ids": []
    },
    {
      "section_id": "sec_008",
      "objective": "implication",
      "narration": "수출액 859억 달러라는 수치는 경상수지 흑자 구조를 공고히 하여 환율 안정과 국가 신인도 제고에 긍정적인 영향을 줄 수 있습니다. 현재까지 확인되는 범위에서는 수출 중심의 경제 회복세가 뚜렷해지는 양상입니다.",
      "claim_ids": [
        "evt_001_cl_02"
      ]
    },
    {
      "section_id": "sec_009",
      "objective": "risk",
      "narration": "다만 특정 품목인 반도체에 대한 의존도가 지나치게 높다는 점은 변동성 리스크로 작용할 수 있습니다. 글로벌 공급망의 변화나 주요국들의 반도체 자급률 제고 정책 등은 장기적으로 지켜봐야 할 변수입니다.",
      "claim_ids": []
    },
    {
      "section_id": "sec_010",
      "objective": "risk",
      "narration": "또한 유가 상승에 따른 원자재 수입 비용 증가가 무역수지 흑자 폭을 제한할 가능성도 상존합니다. 수출이 잘되더라도 비용 측면의 압박이 커진다면 기업들의 실질 이익률은 기대에 못 미칠 수 있습니다.",
      "claim_ids": []
    },
    {
      "section_id": "sec_011",
      "objective": "what_to_watch",
      "narration": "향후 관전 포인트는 5월 이후에도 이러한 반도체 수출의 가파른 증가세가 유지될 수 있느냐는 점입니다. 글로벌 빅테크 기업들의 설비 투자 계획 발표와 미국 금리 경로에 따른 IT 수요 변화를 면밀히 관찰할 필요가 있습니다.",
      "claim_ids": []
    },
    {
      "section_id": "sec_012",
      "objective": "close",
      "narration": "4월의 역대급 수출 실적은 우리 경제에 분명한 긍정적 신호를 주었습니다. 하지만 지표 이면의 리스크 요인들을 함께 점검하며 차분한 관점으로 시장의 흐름을 따라가시길 권해 드립니다.",
      "claim_ids": []
    }
  ]
}