{
  "script_id": "scr_20260505_154402",
  "cluster_id": "evt_001",
  "title": "역대급 기록 경신한 4월 수출, AI 반도체가 쏘아 올린 축포의 실체",
  "tone": "calm_economic_explainer_ko",
  "description": "2026년 4월 대한민국 수출이 역대 두 번째 기록을 달성했습니다. AI 반도체 수요 폭발이 가져온 우리 경제의 변화와 투자자가 주목해야 할 핵심 데이터를 분석합니다.",
  "target_duration_sec": 600,
  "source_article_ids": [
    "art_284adf27fa2e057b",
    "art_45a19d9ffed3e2cf"
  ],
  "source_articles": [
    {
      "article_id": "art_284adf27fa2e057b",
      "title": "반도체 질주에…4월 수출도 800억弗 넘었다",
      "source_name": "한국경제 경제",
      "canonical_url": "https://www.hankyung.com/article/2026050110701",
      "published_at": "2026-05-01T17:52:59+09:00"
    },
    {
      "article_id": "art_45a19d9ffed3e2cf",
      "title": "AI 반도체 수요 지속에 수출 859억弗 역대 2위",
      "source_name": "매일경제 경제",
      "canonical_url": "https://www.mk.co.kr/news/economy/12033603",
      "published_at": "2026-05-01T17:33:34+09:00"
    }
  ],
  "ledger_id": "led_evt_001_20260505_154300",
  "sections": [
    {
      "section_id": "sec_01",
      "objective": "hook",
      "narration": "우리나라 경제의 심장인 수출 엔진이 다시 한번 뜨겁게 달아오르며 우리 지갑의 미래를 바꾸고 있습니다. 최근 발표된 성적표는 단순한 반등을 넘어 새로운 수출 역사를 쓰고 있다는 신호를 보내고 있습니다. 오늘 이야기는 여러분의 투자 포트폴리오를 결정지을 가장 강력한 숫자들에 관한 것입니다.",
      "claim_ids": [
        "evt_001_cl_01"
      ]
    },
    {
      "section_id": "sec_02",
      "objective": "today_core",
      "narration": "지난 4월 우리나라 수출액은 859억 달러를 기록하며 역사상 두 번째로 높은 성적을 거두었습니다. 이는 단순한 호조를 넘어 우리 수출 산업이 확실한 회복 궤도에 진입했음을 보여주는 결정적인 증거입니다. 왜 지금 이 시점에 이런 폭발적인 성장이 가능했는지 그 이면을 들여다봐야 합니다.",
      "claim_ids": [
        "evt_001_cl_01"
      ]
    },
    {
      "section_id": "sec_03",
      "objective": "background",
      "narration": "그동안 우리 경제는 글로벌 경기 둔화와 공급망 불안이라는 이중고를 겪으며 긴 침체기를 지나왔습니다. 하지만 이번 4월의 기록적인 수치는 그런 우려를 한 번에 씻어낼 만큼 강력한 에너지를 보여주었습니다. 수출이 살아난다는 것은 기업의 이익이 늘어나고 결국 주식 시장의 기초 체력이 튼튼해진다는 의미입니다.",
      "claim_ids": [
        "evt_001_cl_01",
        "evt_001_cl_02"
      ]
    },
    {
      "section_id": "sec_04",
      "objective": "evidence",
      "narration": "정부 보도에 따르면 이번 4월 수출액은 전년 같은 달과 비교했을 때 48%나 급증한 것으로 나타났습니다. 1년 전과 비교해 절반 가까이 파이가 커졌다는 것은 전례를 찾아보기 힘든 가파른 성장세입니다. 이 숫자가 과연 일시적인 현상인지 아니면 장기적인 흐름인지 파악하는 것이 투자의 핵심입니다.",
      "claim_ids": [
        "evt_001_cl_02"
      ]
    },
    {
      "section_id": "sec_05",
      "objective": "mechanism",
      "narration": "이런 전례 없는 성장의 중심에는 전 세계를 휩쓸고 있는 인공지능, 즉 AI 혁명이 자리 잡고 있습니다. 전 세계 빅테크 기업들이 AI 서버를 구축하기 위해 한국산 반도체를 앞다투어 확보하려는 경쟁이 붙었기 때문입니다. 결국 AI 열풍이 한국의 수출 창구를 거대한 달러 박스로 바꿔놓고 있는 셈입니다.",
      "claim_ids": [
        "evt_001_cl_01"
      ]
    },
    {
      "section_id": "sec_06",
      "objective": "evidence",
      "narration": "세부 지표를 살펴보면 반도체 수출액이 1년 사이에 3배 가까이 넘게 늘어나며 전체 실적을 독보적으로 견인했습니다. 주력 품목 하나가 이 정도로 폭발적인 성장을 기록하는 것은 우리 수출 구조에서 매우 이례적인 일입니다. 왜 전 세계가 한국의 반도체 공장만 바라보고 있는지 이 숫자가 명확히 증명하고 있습니다.",
      "claim_ids": [
        "evt_001_cl_03"
      ]
    },
    {
      "section_id": "sec_07",
      "objective": "implication",
      "narration": "수출 호조는 단순히 국가 지표 개선에 그치지 않고 관련 부품과 장비 업체들의 낙수 효과로 이어집니다. 기업들의 현금 흐름이 좋아지면 배당 확대나 자사주 매입 같은 주주 환원 정책에 대한 기대감도 함께 커지게 됩니다. 투자자 입장에서는 지금의 수출 성장이 어떤 기업의 실적으로 직결될지 선별하는 안목이 필요합니다.",
      "claim_ids": [
        "evt_001_cl_01"
      ]
    },
    {
      "section_id": "sec_08",
      "objective": "etf_link",
      "narration": "이러한 수출 주도형 성장에 효율적으로 대응하기 위해 많은 투자자가 반도체 섹터 ETF나 수출 우량주 지수를 활용하고 있습니다. 특정 기업의 변동성을 피하면서도 대한민국 수출의 핵심 동력인 반도체 산업 전체의 성장세에 올라타는 전략입니다. 정보 제공 차원에서 볼 때 이러한 간접 투자 방식은 시장의 흐름을 놓치지 않는 방법이 될 수 있습니다.",
      "claim_ids": [
        "evt_001_cl_01"
      ]
    },
    {
      "section_id": "sec_09",
      "objective": "risk",
      "narration": "물론 장밋빛 전망만 있는 것은 아니며 특정 품목에 대한 수출 의존도가 지나치게 높아지는 점은 경계해야 합니다. 글로벌 경기 변동이나 지정학적 리스크로 인해 반도체 수요가 꺾일 경우 우리 경제가 받는 충격도 그만큼 클 수 있기 때문입니다. 환율 변동성 또한 수출 기업들의 최종 수익성에 변수로 작용할 수 있음을 잊지 말아야 합니다.",
      "claim_ids": [
        "evt_001_cl_01"
      ]
    },
    {
      "section_id": "sec_10",
      "objective": "what_to_watch",
      "narration": "앞으로 우리가 주목해야 할 지표는 AI 반도체 수요의 지속성과 주요국들의 설비 투자 규모입니다. 특히 메모리 반도체 가격의 추이와 대형 고객사들의 재고 현황은 향후 수출 실적을 가늠할 나침반이 될 것입니다. 매달 발표되는 수출입 동향 데이터를 통해 우리 경제의 엔진이 계속 힘차게 돌고 있는지 확인해야 합니다.",
      "claim_ids": [
        "evt_001_cl_01"
      ]
    },
    {
      "section_id": "sec_11",
      "objective": "close",
      "narration": "4월의 기록적인 수출 성적은 한국 경제의 잠재력을 다시금 확인시켜준 중요한 이정표였습니다. 하지만 시장은 늘 변화하므로 오늘 본 숫자들이 내일의 수익으로 연결되는 과정을 냉철하게 추적하시기 바랍니다. 대한민국 수출의 다음 행보를 함께 지켜보며 여러분의 성공적인 투자 전략을 세워가시길 응원합니다.",
      "claim_ids": [
        "evt_001_cl_01",
        "evt_001_cl_02"
      ]
    }
  ]
}