{
  "script_id": "scr_20260516_schd_dividend",
  "cluster_id": "manual_schd_dividend_shorts",
  "title": "매년 꾸준히 성장하는 배당? SCHD를 먼저 보는 이유",
  "tone": "premium_gemini_finance_shorts_ko",
  "description": "배당의 질과 지속가능성을 바탕으로 꾸준한 성장을 추구하는 SCHD ETF의 특징과 투자 포인트를 정보 제공 관점에서 설명하는 쇼츠 스크립트입니다. 시청 지속률을 높이는 차분하지만 몰입감 있는 전개에 초점을 맞춥니다.",
  "target_duration_sec": 48,
  "source_article_ids": [
    "schwab_schd_product",
    "stooq_schd_quote_20260515"
  ],
  "source_articles": [
    {
      "article_id": "schwab_schd_product",
      "title": "SCHD | Schwab U.S. Dividend Equity ETF",
      "source_name": "Schwab Asset Management",
      "canonical_url": "https://www.schwabassetmanagement.com/products/schd",
      "published_at": "2026-05-16T20:05:00+09:00"
    },
    {
      "article_id": "stooq_schd_quote_20260515",
      "title": "SCHD.US quote",
      "source_name": "Stooq",
      "canonical_url": "https://stooq.com/q/l/?s=schd.us&f=sd2t2ohlcv&h&e=csv",
      "published_at": "2026-05-15T22:00:20+09:00"
    }
  ],
  "ledger_id": "manual_led_schd_20260516",
  "sections": [
    {
      "section_id": "sec_001",
      "objective": "hook",
      "narration": "매년 꾸준히 늘어나는 배당을 받는다면 어떨까요? 오늘은 단순히 고배당을 넘어, '배당의 질'로 주목받는 ETF, SCHD를 소개합니다.",
      "claim_ids": [
        "1"
      ]
    },
    {
      "section_id": "sec_002",
      "objective": "background",
      "narration": "SCHD는 배당의 '질'과 '지속가능성'을 중시하는 미국 대표 배당 ETF입니다. 무조건 높은 배당률만 쫓는 방식과는 다릅니다.",
      "claim_ids": [
        "1",
        "2"
      ]
    },
    {
      "section_id": "sec_003",
      "objective": "evidence",
      "narration": "또 하나의 장점은 낮은 총보수입니다. 연 0.06%의 비용은 장기 보유에서 새는 돈을 줄이는 데 도움이 됩니다.",
      "claim_ids": [
        "3"
      ]
    },
    {
      "section_id": "sec_004",
      "objective": "etf_link",
      "narration": "이 ETF는 재무구조가 탄탄하고 현금 흐름이 안정적인 기업을 선별합니다. 꾸준히 성장하는 배당을 기대할 수 있는 우량주 위주로 구성되죠.",
      "claim_ids": [
        "2",
        "4"
      ]
    },
    {
      "section_id": "sec_005",
      "objective": "risk",
      "narration": "하지만 주의할 점도 있습니다. SCHD는 월배당 상품이 아니며, 주가는 시장 상황에 따라 변동합니다. 배당 외에 원금 손실 가능성도 항상 염두에 두세요.",
      "claim_ids": [
        "5"
      ]
    },
    {
      "section_id": "sec_006",
      "objective": "close",
      "narration": "SCHD는 단순 고배당이 아닌 '배당의 질'과 '성장'을 추구하는 투자자에게 매력적일 수 있습니다. 본인의 투자 목표에 맞춰 신중히 판단하시기 바랍니다.",
      "claim_ids": [
        "6"
      ]
    }
  ]
}
