{
  "script_id": "scr_20260505_154208",
  "cluster_id": "evt_001",
  "title": "역대급 4월 수출, 반도체 3배 성장이 가져온 변화와 투자 전략",
  "tone": "calm_economic_explainer_ko",
  "description": "반도체 수출이 1년 새 3배 가까이 증가하며 4월 수출액이 역대 2위를 기록했습니다. AI 수요가 이끈 이번 수출 호조의 배경과 투자자가 반드시 체크해야 할 리스크를 분석합니다.",
  "target_duration_sec": 600,
  "source_article_ids": [
    "art_284adf27fa2e057b",
    "art_45a19d9ffed3e2cf"
  ],
  "source_articles": [
    {
      "article_id": "art_284adf27fa2e057b",
      "title": "반도체 질주에…4월 수출도 800억弗 넘었다",
      "source_name": "한국경제 경제",
      "canonical_url": "https://www.hankyung.com/article/2026050110701",
      "published_at": "2026-05-01T17:52:59+09:00"
    },
    {
      "article_id": "art_45a19d9ffed3e2cf",
      "title": "AI 반도체 수요 지속에 수출 859억弗 역대 2위",
      "source_name": "매일경제 경제",
      "canonical_url": "https://www.mk.co.kr/news/economy/12033603",
      "published_at": "2026-05-01T17:33:34+09:00"
    }
  ],
  "ledger_id": "led_evt_001_20260505_154112",
  "sections": [
    {
      "section_id": "section_1",
      "objective": "hook",
      "narration": "우리의 지갑 사정과 직결되는 국가 수출 지표가 역대급 기록을 경신하고 있습니다. 최근 보도에 따르면 4월 한 달 동안 한국 경제의 저력을 보여주는 놀라운 결과가 발표되었습니다. 과연 이 수치가 우리 실물 경제와 투자 시장에 어떤 변화를 예고하는지 지금부터 살펴보겠습니다.",
      "claim_ids": [
        "claim_1",
        "claim_2"
      ]
    },
    {
      "section_id": "section_2",
      "objective": "today_core",
      "narration": "지난 4월 우리나라 수출액은 859억 달러를 기록하며 역대 두 번째로 높은 성적을 냈습니다. 이는 작년 같은 기간과 비교했을 때 무려 48%나 증가한 수치로 시장의 기대를 뛰어넘었습니다. 왜 이 시점에 이런 폭발적인 성장이 나타났는지 그 구체적인 원인을 분석할 필요가 있습니다.",
      "claim_ids": [
        "claim_1",
        "claim_2",
        "claim_3"
      ]
    },
    {
      "section_id": "section_3",
      "objective": "background",
      "narration": "수출 규모가 800억 달러를 넘어선 배경에는 전 세계적인 산업 구조의 변화가 자리 잡고 있습니다. 특히 디지털 전환과 인공지능 기술의 확산이 우리 기업들에게 거대한 공급 기회를 제공하고 있습니다. 이번 성장이 단순한 기저 효과인지 아니면 새로운 호황의 시작인지가 투자의 핵심 포인트입니다.",
      "claim_ids": [
        "claim_5"
      ]
    },
    {
      "section_id": "section_4",
      "objective": "evidence",
      "narration": "가장 눈에 띄는 부분은 단연 반도체 분야의 압도적인 질주입니다. 보도에 따르면 반도체 수출액은 불과 1년 만에 3배 가까이 늘어나며 전체 실적을 강력하게 견인했습니다. 왜 반도체가 다시 한국 경제의 구원투수로 등판했는지 데이터로 확인해 보겠습니다.",
      "claim_ids": [
        "claim_4"
      ]
    },
    {
      "section_id": "section_5",
      "objective": "mechanism",
      "narration": "인공지능 서버와 데이터 센터 수요가 폭증하면서 고성능 반도체 주문이 쏟아지고 있습니다. 글로벌 빅테크 기업들이 앞다투어 인프라를 구축하면서 우리 반도체의 수출 단가와 물량이 동시에 상승하고 있습니다. 이러한 선순환 구조가 수출 역대 2위라는 결과로 이어진 핵심 메커니즘입니다.",
      "claim_ids": [
        "claim_1",
        "claim_3"
      ]
    },
    {
      "section_id": "section_6",
      "objective": "implication",
      "narration": "수출 호조는 기업 실적을 넘어 국가 전체의 달러 수급과 경상수지에 긍정적인 영향을 줍니다. 이는 원화 가치의 안정과 수입 물가 관리에도 기여할 수 있는 중요한 거시 경제 신호입니다. 왜 지금의 수출 지표를 일반 투자자들도 눈여겨봐야 하는지 알 수 있는 대목입니다.",
      "claim_ids": [
        "claim_1"
      ]
    },
    {
      "section_id": "section_7",
      "objective": "etf_link",
      "narration": "반도체 중심의 수출 성장이 지속된다면 관련 기업들을 한데 묶은 상장지수펀드(ETF)에 대한 관심도 높아질 수 있습니다. 정보 제공 관점에서 보면 국내외 반도체 지수를 추종하는 상품들이 시장의 흐름을 반영하는 주요 도구가 됩니다. 개별 종목의 변동성을 관리하며 업황 전체에 투자하려는 분들에게는 하나의 선택지가 될 수 있습니다.",
      "claim_ids": [
        "claim_1"
      ]
    },
    {
      "section_id": "section_8",
      "objective": "risk",
      "narration": "긍정적인 데이터 이면에는 특정 품목에 대한 의존도가 지나치게 높다는 리스크도 존재합니다. 반도체 업황이 예기치 않게 흔들릴 경우 국가 전체 수출이 급격히 냉각될 수 있다는 우려가 나옵니다. 왜 우리가 포트폴리오 다변화와 다른 산업군의 회복 여부를 함께 점검해야 하는지 고민이 필요한 시점입니다.",
      "claim_ids": [
        "claim_1"
      ]
    },
    {
      "section_id": "section_9",
      "objective": "what_to_watch",
      "narration": "앞으로 주목해야 할 지표는 글로벌 금리 경로와 주요 수출국의 경기 선행 지수입니다. 수출의 지속 가능성을 확인하기 위해서는 반도체 재고 상황과 가격 추이를 면밀히 살펴야 합니다. 다음 달 발표될 통계에서도 800억 달러 이상의 흐름이 유지되는지가 관건입니다.",
      "claim_ids": [
        "claim_5"
      ]
    },
    {
      "section_id": "section_10",
      "objective": "close",
      "narration": "오늘 우리는 4월 수출 859억 달러 달성과 반도체의 3배 성장이 갖는 의미를 정리해 보았습니다. 화려한 숫자 뒤에 숨은 산업별 편차와 리스크를 점검하며 차분한 투자 관점을 유지하시길 바랍니다. 다음 시간에도 시장의 핵심 데이터를 가장 정확하게 전달해 드리겠습니다.",
      "claim_ids": [
        "claim_1",
        "claim_4"
      ]
    }
  ]
}