{
  "script_id": "scr_20260516_schd_dividend",
  "cluster_id": "manual_schd_dividend_shorts",
  "title": "배당 ETF 하나만 고르라면 SCHD를 먼저 보는 이유 (스토리+수치)",
  "tone": "calm_finance_explainer_ko",
  "description": "SCHD를 배당률보다 배당의 지속가능성과 낮은 보수, 그리고 '월급처럼 받을 수 있는' 가능성에 초점을 맞춰 소개하는 쇼츠 스크립트입니다.",
  "target_duration_sec": 48,
  "source_article_ids": [
    "schwab_schd_product",
    "stooq_schd_quote_20260515"
  ],
  "source_articles": [
    {
      "article_id": "schwab_schd_product",
      "title": "SCHD | Schwab U.S. Dividend Equity ETF",
      "source_name": "Schwab Asset Management",
      "canonical_url": "https://www.schwabassetmanagement.com/products/schd",
      "published_at": "2026-05-16T20:05:00+09:00"
    },
    {
      "article_id": "stooq_schd_quote_20260515",
      "title": "SCHD.US quote",
      "source_name": "Stooq",
      "canonical_url": "https://stooq.com/q/l/?s=schd.us&f=sd2t2ohlcv&h&e=csv",
      "published_at": "2026-05-15T22:00:20+09:00"
    }
  ],
  "ledger_id": "manual_led_schd_20260516",
  "sections": [
    {
      "section_id": "sec_001",
      "objective": "hook",
      "narration": "상상해보세요. 매달 월급 외에 100만원이 꼬박꼬박 쌓인다면? 단순 고배당 ETF가 아닌, '배당의 질'과 '지속가능성'으로 월급처럼 받을 수 있는 SCHD를 먼저 살펴보겠습니다.",
      "claim_ids": ["1"]
    },
    {
      "section_id": "sec_002",
      "objective": "background",
      "narration": "SCHD는 맹목적으로 배당만 쫓지 않습니다. 미국 대표 100개 배당 기업 중, '배당의 질'과 '지속가능성'을 기준으로 엄선된 종목들로 구성되어 있습니다.",
      "claim_ids": ["1", "2"]
    },
    {
      "section_id": "sec_003",
      "objective": "evidence",
      "narration": "연 0.06%라는 낮은 보수는 장기 투자 시 큰 무기가 됩니다. 예를 들어, 비슷한 ETF가 0.5% 보수라면, 10년 동안 약 수백 달러를 더 절약할 수 있고, 이 돈이 복리로 불어나 배당 수익률을 더욱 높여줍니다.",
      "claim_ids": ["3"]
    },
    {
      "section_id": "sec_004",
      "objective": "etf_link",
      "narration": "SCHD는 탄탄한 재무구조와 꾸준한 배당 성장을 보여온 우량 기업들을 선별합니다. (예: 코카콜라, 펩시코 같은 안정적인 소비재 기업이나 IBM 같은 꾸준한 현금흐름을 내는 대형주 등) 단순 고배당보다 '기업의 퀄리티'에 초점을 맞추는 이유입니다.",
      "claim_ids": ["2", "4"]
    },
    {
      "section_id": "sec_005",
      "objective": "risk",
      "narration": "하지만 명심해야 할 점이 있습니다. SCHD는 월배당 ETF가 아니며, 주가 자체는 시장 상황에 따라 변동할 수 있습니다. '월급처럼 꾸준한 추가 수입'을 기대할 수 있지만, 원금 손실 가능성도 항상 염두에 두어야 합니다.",
      "claim_ids": ["5"]
    },
    {
      "section_id": "sec_006",
      "objective": "close",
      "narration": "결론적으로 SCHD는 '고배당'을 넘어 '배당 성장'과 '퀄리티'를 추구하는 투자자에게 매력적인 선택지가 될 수 있습니다. 꾸준한 현금 흐름과 기업 성장을 함께 노린다면요. 투자는 언제나 '나의 목표'와 '나의 기준'에 맞춰 신중하게 결정해야 합니다.",
      "claim_ids": ["6"]
    }
  ]
}