{
  "script_id": "scr_20260503_183110",
  "cluster_id": "evt_001",
  "title": "4월 수출 859억 달러 달성, AI 반도체가 견인한 역대",
  "tone": "calm_economic_explainer_ko",
  "description": "최근 발표된 4월 수출 지표를 통해 반도체 산업의 회복세와 AI 수요의 영향을 분석합니다. 거시경제 지표의 변화와 반도체 관련 ETF 시장의 흐름을 객관적으로 짚어봅니다.",
  "target_duration_sec": 260,
  "source_article_ids": [
    "art_284adf27fa2e057b",
    "art_45a19d9ffed3e2cf"
  ],
  "ledger_id": "led_evt_001_20260503_182808",
  "sections": [
    {
      "section_id": "section_01",
      "objective": "hook",
      "narration": "국내 경제의 핵심 동력인 수출 지표에서 주목할 만한 숫자가 포착되었습니다. 지난 4월 수출액이 역대급 기록을 경신하며 시장의 관심을 모으고 있습니다.",
      "claim_ids": [
        "evt_001_cl_01"
      ]
    },
    {
      "section_id": "section_02",
      "objective": "today_core",
      "narration": "산업통상자원부에 따르면 4월 수출액은 약 859억 달러를 기록했습니다. 이는 전년 동월 대비 약 48% 증가한 수치로, 역대 두 번째로 높은 기록인 것으로 확인됩니다.",
      "claim_ids": [
        "evt_001_cl_02"
      ]
    },
    {
      "section_id": "section_03",
      "objective": "background",
      "narration": "글로벌 경기 둔화 우려 속에서도 한국 수출이 반등한 배경에는 반도체 업황의 회복이 자리 잡고 있습니다. 특히 지난 1년간의 부진을 딛고 가파른 상승 곡선을 그리는 모습입니다.",
      "claim_ids": [
        "evt_001_cl_01"
      ]
    },
    {
      "section_id": "section_04",
      "objective": "evidence",
      "narration": "구체적인 수치를 보면 반도체 수출액이 1년 사이 3배 가까이 증가하며 전체 실적을 이끈 것으로 나타났습니다. 4월 한 달에만 800억 달러를 돌파하며 수출 강국의 면모를 보였습니다.",
      "claim_ids": [
        "evt_001_cl_01",
        "evt_001_cl_02"
      ]
    },
    {
      "section_id": "section_05",
      "objective": "mechanism",
      "narration": "시장에서는 이러한 성장의 주요 원인으로 AI 서버 및 인프라 구축을 위한 반도체 수요의 지속성을 꼽고 있습니다. 고대역폭 메모리 등 고부가가치 제품의 비중이 확대되는 흐름이 관측됩니다.",
      "claim_ids": [
        "evt_001_cl_02"
      ]
    },
    {
      "section_id": "section_06",
      "objective": "mechanism",
      "narration": "기사 흐름상 이러한 반도체 수출의 증가는 국내 경상수지 개선과 기업들의 실적 반등에 긍정적인 기초 체력을 제공하고 있습니다. 물량 증가와 단가 상승이 동시에 작용하는 구조입니다.",
      "claim_ids": [
        "evt_001_cl_02"
      ]
    },
    {
      "section_id": "section_07",
      "objective": "etf_link",
      "narration": "투자 시장에서는 이러한 흐름에 대응하여 국내 반도체 소부장 ETF나 글로벌 AI 반도체 ETF에 대한 거래가 활발해지고 있습니다. 다만 기초 자산의 변동성을 고려한 신중한 관찰이 필요합니다.",
      "claim_ids": []
    },
    {
      "section_id": "section_08",
      "objective": "implication",
      "narration": "수출 호조는 결과적으로 국내 증시의 이익 전망치를 상향 조정하는 근거가 됩니다. 현재까지 확인되는 범위에서는 반도체 중심의 수출 구조가 당분간 지속될 가능성이 제기됩니다.",
      "claim_ids": [
        "evt_001_cl_02"
      ]
    },
    {
      "section_id": "section_09",
      "objective": "risk",
      "narration": "하지만 낙관론만 있는 것은 아닙니다. 글로벌 지정학적 리스크나 환율 변동성, 그리고 기저 효과에 따른 통계적 착시 가능성 등은 향후 지표 확인 시 유의해야 할 요소입니다.",
      "claim_ids": []
    },
    {
      "section_id": "section_10",
      "objective": "what_to_watch",
      "narration": "앞으로 살펴봐야 할 포인트는 주요 빅테크 기업들의 설비 투자 규모 유지 여부입니다. 반도체 재고 수준과 선행 지표들이 실제 수출 실적으로 연결되는지 지속적인 모니터링이 필요합니다.",
      "claim_ids": []
    },
    {
      "section_id": "section_11",
      "objective": "close",
      "narration": "4월의 강력한 수출 지표는 한국 경제의 회복 탄력성을 보여주는 신호로 해석됩니다. 냉철한 시각으로 후속 지표들을 확인하며 시장의 변화를 살피시길 바랍니다. 감사합니다.",
      "claim_ids": []
    }
  ]
}